
<ccmm:dataset 
    xmlns:ccmm="https://www.techlib.cz/ontologies/czech-core-metadata-model/"
    xmlns:xsi="http://www.w3.org/2001/XMLSchema-instance"
    xsi:schemaLocation="https://www.techlib.cz/ontologies/czech-core-metadata-model/ ccmm-v01.xsd">

    <ccmm:identifier identifierScheme="DOI">10.5281/zenodo.14001488</ccmm:identifier>
    <ccmm:alternateIdentifiers>
        <ccmm:alternateIdentifier identifierScheme="handle">20.500/1257</ccmm:alternateIdentifier>
        <ccmm:alternateIdentifier identifierScheme="URL">https://zenodo.org/records/14001488</ccmm:alternateIdentifier>
        <ccmm:alternateIdentifier identifierScheme="oai">oai:zenodo.org:14001488</ccmm:alternateIdentifier>
    </ccmm:alternateIdentifiers>

    <ccmm:title lang="en"> Very important dataset </ccmm:title>
    <ccmm:alternateTitles>
        <ccmm:alternateTitle lang="cs"> Velmi dulezita datova sada </ccmm:alternateTitle>
    </ccmm:alternateTitles>

    <ccmm:resourceType>lab notebook</ccmm:resourceType>
    <ccmm:abstract lang="en">very and very important</ccmm:abstract>

    <ccmm:creators>
        <ccmm:creator xsi:type="ccmm:PersonType">
            <ccmm:identifier identifierScheme="ORCID">0000-0001-5727-2427</ccmm:identifier>
            <ccmm:givenName>Sofia</ccmm:givenName>
            <ccmm:familyName>Garcia</ccmm:familyName>
            <ccmm:affiliation>
                <ccmm:identifier identifierScheme="ROR" valueURI="https://ror.org/03efmqc40">03efmqc40</ccmm:identifier>
                <ccmm:organizationName>Arizona State University</ccmm:organizationName>
                <ccmm:alternateName>Arizona State Uni</ccmm:alternateName>
                <ccmm:alternateName>ASU</ccmm:alternateName>
            </ccmm:affiliation>
        </ccmm:creator>

        <ccmm:creator xsi:type="ccmm:OrganizationType">
            <ccmm:identifier identifierScheme="ROR" schemeURI="https://ror.org/">03yrm5c26</ccmm:identifier>
            <ccmm:organizationName>California Digital Library</ccmm:organizationName>
        </ccmm:creator>
    </ccmm:creators>

    <ccmm:contributors>
        <ccmm:contributor role="DataCollector">
            <ccmm:identifier identifierScheme="ORCID">0000-0002-1825-0097</ccmm:identifier>
            <ccmm:givenName>Jordan</ccmm:givenName>
            <ccmm:familyName>Lee</ccmm:familyName>
            <ccmm:affiliation>
                <ccmm:identifier identifierScheme="ROR">03yrm5c26</ccmm:identifier>
                <ccmm:organizationName>University of California</ccmm:organizationName>
            </ccmm:affiliation>
        </ccmm:contributor>
    </ccmm:contributors>

    <ccmm:publishers>
        <ccmm:publisher>
            <ccmm:identifier identifierScheme="URL">https://zenodo.org</ccmm:identifier>
            <ccmm:organizationName>zenodo</ccmm:organizationName>
        </ccmm:publisher>
    </ccmm:publishers>

    <ccmm:funding>
        <ccmm:award>
            <ccmm:localIdentifier identifierScheme="cordis" valueURI="https://cordis.europa.eu/project/id/874457">894457</ccmm:localIdentifier>
            <ccmm:alternateIdentifier identifierScheme="DOI">10.3030/874465</ccmm:alternateIdentifier>
            <ccmm:alternateIdentifier identifierScheme="URL">https://app.dimensions.ai/details/grant/grant.8586176</ccmm:alternateIdentifier>
            <ccmm:awardTitle>Motion Powered 3D Printed Self-Healable Energy Storage</ccmm:awardTitle>
            <ccmm:fundingProgram>H2020</ccmm:fundingProgram>
            <ccmm:funder>
                <ccmm:organizationName>European Commission</ccmm:organizationName>
            </ccmm:funder>
        </ccmm:award>

        <ccmm:award>
            <ccmm:localIdentifier identifierScheme="isvavai">GA 456/2016</ccmm:localIdentifier>
            <ccmm:awardTitle lang="en">Supa Dupa Energy Storage</ccmm:awardTitle>
            <ccmm:funder>
                <ccmm:organizationName>Grantova agentura CR</ccmm:organizationName>
                <ccmm:alternateName>GACR</ccmm:alternateName>
            </ccmm:funder>
        </ccmm:award>

    </ccmm:funding>

    <ccmm:subjects>
        <ccmm:subject subjectScheme="Fields of Science and Technology (FOS)" schemeURI="http://www.oecd.org/science/inno/38235147.pdf">FOS: Earth and related environmental sciences</ccmm:subject>
        <ccmm:subject subjectScheme="Wikidata" schemeURI="https://www.wikidata.org/wiki" valueURI="https://www.wikidata.org/wiki/Q11466">temperature</ccmm:subject>
        <ccmm:subject subjectScheme="Art and Architecture Thesaurus" schemeURI="http://vocab.getty.edu/aat" valueURI="http://vocab.getty.edu/aat/300192097">relative humidity</ccmm:subject>
        <ccmm:subject subjectScheme="Wikidata" schemeURI="https://www.wikidata.org/wiki" valueURI="https://www.wikidata.org/wiki/Q194411">illuminance</ccmm:subject>
        <ccmm:subject subjectScheme="Art and Architecture Thesaurus" schemeURI="http://vocab.getty.edu/aat" valueURI="http://vocab.getty.edu/aat/300379432">moisture content</ccmm:subject>
        <ccmm:subject subjectScheme="FAST" schemeURI="http://id.worldcat.org/fast" valueURI="http://id.worldcat.org/fast/913214">Environmental monitoring</ccmm:subject>
        <ccmm:subject lang="en">temperature</ccmm:subject>
        <ccmm:subject lang="cs">teplota</ccmm:subject>
        
    </ccmm:subjects>

    <ccmm:termsOfUse>
        <ccmm:accessRights rightsURI="http://purl.org/coar/access_right/c_16ec">restricted access</ccmm:accessRights>
        <ccmm:rights rightsType="license" rightsURI="https://creativecommons.org/licenses/by-nc/4.0/">CC-BY-4.0</ccmm:rights>
        <ccmm:rights rightsType="personalData" rightsURI="https://data.gov.cz/podm%C3%ADnky-u%C5%BEit%C3%AD/nen%C3%AD-specifikov%C3%A1no-zda-obsahuje-osobn%C3%AD-%C3%BAdaje/">Není specifikováno, zda obsahuje osobní údaje.</ccmm:rights>
    </ccmm:termsOfUse>

    <ccmm:timeReferences>
        <ccmm:publicationYear>2022</ccmm:publicationYear>
        <ccmm:date dateType="collected">2010/2020</ccmm:date>
        <ccmm:date dateType="timeCoverage">2010/2020</ccmm:date>
    </ccmm:timeReferences>
</ccmm:dataset>
